[
  {
    "validation_id": "val-synthetic-pa-l1",
    "submission_id": "sub-synthetic-pa-1",
    "layer": "L1_schema",
    "verdict": "pass",
    "decided_at": "2026-08-09T10:27:00+08:00",
    "synthetic": true,
    "automated": true,
    "validator_ref": "tool:validate_v02",
    "per_unit_verdicts": [
      { "unit_id": "unit-synthetic-011", "verdict": "pass" },
      { "unit_id": "unit-synthetic-012", "verdict": "pass" },
      { "unit_id": "unit-synthetic-013", "verdict": "pass" }
    ]
  },
  {
    "validation_id": "val-synthetic-pa-l2",
    "submission_id": "sub-synthetic-pa-1",
    "layer": "L2_rule",
    "verdict": "partial",
    "decided_at": "2026-08-09T10:28:00+08:00",
    "synthetic": true,
    "automated": true,
    "validator_ref": "tool:validate_v02",
    "error_codes": ["E_RULE_LENGTH_OUT_OF_RANGE"],
    "per_unit_verdicts": [
      { "unit_id": "unit-synthetic-011", "verdict": "pass", "redline_hit": false },
      {
        "unit_id": "unit-synthetic-012",
        "verdict": "fail",
        "error_codes": ["E_RULE_LENGTH_OUT_OF_RANGE"],
        "redline_hit": false,
        "measured": "length=2"
      },
      { "unit_id": "unit-synthetic-013", "verdict": "pass", "redline_hit": false }
    ]
  },
  {
    "validation_id": "val-synthetic-pa-l3",
    "submission_id": "sub-synthetic-pa-1",
    "layer": "L3_crosscheck",
    "verdict": "skipped",
    "decided_at": "2026-08-09T10:29:00+08:00",
    "synthetic": true,
    "automated": true,
    "notes": "replication_factor=1，无 gold set。"
  },
  {
    "validation_id": "val-synthetic-pa-l4",
    "submission_id": "sub-synthetic-pa-1",
    "layer": "L4_human",
    "verdict": "partial",
    "decided_at": "2026-08-09T10:50:00+08:00",
    "synthetic": true,
    "automated": false,
    "validator_ref": "pseudo-reviewer-1",
    "sample_ratio": 1.0,
    "extrapolated": false,
    "per_unit_verdicts": [
      { "unit_id": "unit-synthetic-011", "verdict": "pass" },
      { "unit_id": "unit-synthetic-012", "verdict": "fail", "error_codes": ["E_RULE_LENGTH_OUT_OF_RANGE"], "notes": "L2 已判失败，人工确认需返工" },
      { "unit_id": "unit-synthetic-013", "verdict": "pass" }
    ]
  }
]
